{"captured_at":"2026-08-04T12:00:00Z","captured_epoch_seconds":1785844800,"configuration_fingerprint":"aaaaaaaaaaaaaaaaaaaaaaaaaaaaaaaaaaaaaaaaaaaaaaaaaaaaaaaaaaaaaaaa","last_applied_event_id":"event-1","schema_version":"2.0","state":{"coordinator":{"policy_id":"bounded_ports_v1","schema_version":"1.0","seen_event_ids":["event-1"]},"fragments":[{"entries":{"events":"1"},"provider_id":"episode_boundary_impl","schema_version":"1.0","state_schema_version":"1.0"}],"required_provider_ids":["episode_boundary_impl"],"schema_version":"1.0"},"checksum":"b005c0ca7eaeef69973a3ebeb111dbba549d2720d2fc0208b160f9dcdc77e0c5"}
